    1   0.000000 20.52.64.201 → 192.168.1.8  TCP 54 443 → 53183 [RST, ACK] Seq=1 Ack=1 Win=0 Len=0
    2   2.880997  192.168.1.8 → 20.42.73.31  TCP 54 53202 → 443 [FIN, ACK] Seq=1 Ack=1 Win=253 Len=0
    3   2.881239 2401:4900:8840:b020:556f:99ec:de73:e6dd → 2600:1417:56::174c:9d09 TCP 74 53200 → 443 [FIN, ACK] Seq=1 Ack=1 Win=252 Len=0
    4   2.881485  192.168.1.8 → 204.79.197.222 TCP 54 53208 → 443 [FIN, ACK] Seq=1 Ack=1 Win=252 Len=0
    5   2.881591  192.168.1.8 → 13.107.18.254 TCP 54 53205 → 443 [FIN, ACK] Seq=1 Ack=1 Win=255 Len=0
    6   2.881668 2401:4900:8840:b020:556f:99ec:de73:e6dd → 2603:1063:27:1::254 TCP 74 53207 → 443 [FIN, ACK] Seq=1 Ack=1 Win=250 Len=0
    7   2.881759 2401:4900:8840:b020:556f:99ec:de73:e6dd → 2620:1ec:8f8::254 TCP 74 53204 → 443 [FIN, ACK] Seq=1 Ack=1 Win=250 Len=0
    8   2.886744 2600:1417:56::174c:9d09 → 2401:4900:8840:b020:556f:99ec:de73:e6dd TLSv1.2 98 Application Data
    9   2.886845 2401:4900:8840:b020:556f:99ec:de73:e6dd → 2600:1417:56::174c:9d09 TCP 74 53200 → 443 [RST, ACK] Seq=2 Ack=25 Win=0 Len=0
   10   2.887454 2600:1417:56::174c:9d09 → 2401:4900:8840:b020:556f:99ec:de73:e6dd TCP 74 443 → 53200 [FIN, ACK] Seq=25 Ack=2 Win=1105 Len=0
   11   2.888555 204.79.197.222 → 192.168.1.8  TCP 54 443 → 53208 [FIN, ACK] Seq=1 Ack=2 Win=16386 Len=0
   12   2.888555 204.79.197.222 → 192.168.1.8  TCP 54 [TCP Keep-Alive] 443 → 53208 [ACK] Seq=1 Ack=2 Win=16386 Len=0
   13   2.888610  192.168.1.8 → 204.79.197.222 TCP 54 53208 → 443 [ACK] Seq=2 Ack=2 Win=252 Len=0
   14   2.888786 2603:1063:27:1::254 → 2401:4900:8840:b020:556f:99ec:de73:e6dd TCP 74 443 → 53207 [ACK] Seq=1 Ack=2 Win=16388 Len=0
   15   2.889207 2603:1063:27:1::254 → 2401:4900:8840:b020:556f:99ec:de73:e6dd TCP 74 443 → 53207 [FIN, ACK] Seq=1 Ack=2 Win=16388 Len=0
   16   2.889271 2401:4900:8840:b020:556f:99ec:de73:e6dd → 2603:1063:27:1::254 TCP 74 53207 → 443 [ACK] Seq=2 Ack=2 Win=250 Len=0
   17   2.910151 13.107.18.254 → 192.168.1.8  TCP 54 443 → 53205 [ACK] Seq=1 Ack=2 Win=16386 Len=0
   18   2.921957 13.107.18.254 → 192.168.1.8  TCP 54 443 → 53205 [FIN, ACK] Seq=1 Ack=2 Win=16386 Len=0
   19   2.922209  192.168.1.8 → 13.107.18.254 TCP 54 53205 → 443 [ACK] Seq=2 Ack=2 Win=255 Len=0
   20   2.927253 2620:1ec:8f8::254 → 2401:4900:8840:b020:556f:99ec:de73:e6dd TCP 74 443 → 53204 [FIN, ACK] Seq=1 Ack=2 Win=16388 Len=0
   21   2.927336 2401:4900:8840:b020:556f:99ec:de73:e6dd → 2620:1ec:8f8::254 TCP 74 53204 → 443 [ACK] Seq=2 Ack=2 Win=250 Len=0
   22   2.927393 2620:1ec:8f8::254 → 2401:4900:8840:b020:556f:99ec:de73:e6dd TCP 74 [TCP Keep-Alive] 443 → 53204 [ACK] Seq=1 Ack=2 Win=16388 Len=0
   23   2.927422 2401:4900:8840:b020:556f:99ec:de73:e6dd → 2620:1ec:8f8::254 TCP 74 [TCP ZeroWindow] 53204 → 443 [ACK] Seq=2 Ack=2 Win=0 Len=0
   24   2.971590 2620:1ec:8f8::254 → 2401:4900:8840:b020:556f:99ec:de73:e6dd TCP 74 443 → 53204 [RST] Seq=2 Win=0 Len=0
   25   3.099474  20.42.73.31 → 192.168.1.8  TCP 54 443 → 53202 [FIN, ACK] Seq=1 Ack=2 Win=16382 Len=0
   26   3.099619  192.168.1.8 → 20.42.73.31  TCP 54 53202 → 443 [ACK] Seq=2 Ack=2 Win=253 Len=0
   27   3.151865 54.237.141.217 → 192.168.1.8  TCP 54 443 → 53198 [FIN, ACK] Seq=1 Ack=1 Win=119 Len=0
   28   3.151865 54.237.141.217 → 192.168.1.8  TCP 85 [TCP Out-Of-Order] 443 → 53198 [PSH, ACK] Seq=4294967266 Ack=1 Win=119 Len=31
   29   3.151979  192.168.1.8 → 54.237.141.217 TCP 54 53198 → 443 [ACK] Seq=1 Ack=4294967266 Win=253 Len=0
   30   3.152034  192.168.1.8 → 54.237.141.217 TCP 54 53198 → 443 [ACK] Seq=1 Ack=2 Win=252 Len=0
   31   3.830596  192.168.1.8 → 54.237.141.217 TCP 54 53198 → 443 [RST, ACK] Seq=1 Ack=2 Win=0 Len=0
   32   3.842616  192.168.1.8 → 18.214.207.192 TCP 66 53218 → 443 [SYN] Seq=0 Win=65535 Len=0 MSS=1460 WS=256 SACK_PERM
   33   3.906573 2401:4900:8840:b020:556f:99ec:de73:e6dd → 2603:1040:a03:9::fa TLSv1.2 124 Application Data
   34   3.952488 2603:1040:a03:9::fa → 2401:4900:8840:b020:556f:99ec:de73:e6dd TLSv1.2 113 Application Data
   35   3.998566 2401:4900:8840:b020:556f:99ec:de73:e6dd → 2603:1040:a03:9::fa TCP 74 52463 → 443 [ACK] Seq=51 Ack=40 Win=253 Len=0
   36   4.101857 18.214.207.192 → 192.168.1.8  TCP 66 443 → 53218 [SYN, ACK] Seq=0 Ack=1 Win=26883 Len=0 MSS=1250 SACK_PERM WS=256
   37   4.102104  192.168.1.8 → 18.214.207.192 TCP 54 53218 → 443 [ACK] Seq=1 Ack=1 Win=65280 Len=0
   38   4.102785  192.168.1.8 → 18.214.207.192 TLSv1.2 416 Client Hello (SNI=win-extension.femetrics.grammarly.io)
   39   4.361658 18.214.207.192 → 192.168.1.8  TCP 54 443 → 53218 [ACK] Seq=1 Ack=363 Win=28160 Len=0
   40   4.361658 18.214.207.192 → 192.168.1.8  TLSv1.2 1304 Server Hello
   41   4.361776 18.214.207.192 → 192.168.1.8  TCP 2554 443 → 53218 [ACK] Seq=1251 Ack=363 Win=28160 Len=2500
   42   4.361812 18.214.207.192 → 192.168.1.8  TLSv1.2 599 Certificate, Server Key Exchange, Server Hello Done
   43   4.361986  192.168.1.8 → 18.214.207.192 TCP 54 53218 → 443 [ACK] Seq=363 Ack=3751 Win=65280 Len=0
   44   4.362095  192.168.1.8 → 18.214.207.192 TCP 54 53218 → 443 [ACK] Seq=363 Ack=4296 Win=64768 Len=0
   45   4.364217  192.168.1.8 → 18.214.207.192 TLSv1.2 180 Client Key Exchange, Change Cipher Spec, Encrypted Handshake Message
   46   4.623855 18.214.207.192 → 192.168.1.8  TCP 54 443 → 53218 [ACK] Seq=4296 Ack=489 Win=28160 Len=0
   47   4.623855 18.214.207.192 → 192.168.1.8  TLSv1.2 258 New Session Ticket, Change Cipher Spec, Encrypted Handshake Message
   48   4.628448  192.168.1.8 → 18.214.207.192 TLSv1.2 226 Application Data
   49   4.886431 18.214.207.192 → 192.168.1.8  TLSv1.2 108 Application Data
   50   4.887000  192.168.1.8 → 18.214.207.192 TLSv1.2 1378 Application Data
   51   5.145261 18.214.207.192 → 192.168.1.8  TCP 54 443 → 53218 [ACK] Seq=4554 Ack=1985 Win=31744 Len=0
   52   5.167509 18.214.207.192 → 192.168.1.8  TLSv1.2 608 Application Data
   53   5.218763  192.168.1.8 → 18.214.207.192 TCP 54 53218 → 443 [ACK] Seq=1985 Ack=5108 Win=65280 Len=0
   54   5.656660  192.168.1.8 → 91.108.56.178 SSL 239 Continuation Data
   55   5.729381 91.108.56.178 → 192.168.1.8  TCP 56 443 → 52443 [ACK] Seq=1 Ack=186 Win=7194 Len=0
   56   7.149601 2401:4900:8840:b020:556f:99ec:de73:e6dd → 2600:1417:56::174c:9d0a TCP 74 53179 → 443 [FIN, ACK] Seq=1 Ack=1 Win=255 Len=0
   57   7.149883 2401:4900:8840:b020:556f:99ec:de73:e6dd → 2600:1417:56::174c:9d0a TCP 74 53181 → 443 [FIN, ACK] Seq=1 Ack=1 Win=255 Len=0
   58   7.150198 2401:4900:8840:b020:556f:99ec:de73:e6dd → 2600:1417:56::174c:9d0a TCP 74 53180 → 443 [FIN, ACK] Seq=1 Ack=1 Win=255 Len=0
   59   7.154734 2600:1417:56::174c:9d0a → 2401:4900:8840:b020:556f:99ec:de73:e6dd TCP 74 443 → 53179 [FIN, ACK] Seq=25 Ack=2 Win=545 Len=0
   60   7.154734 2600:1417:56::174c:9d0a → 2401:4900:8840:b020:556f:99ec:de73:e6dd TCP 74 443 → 53181 [FIN, ACK] Seq=25 Ack=2 Win=558 Len=0
   61   7.154734 2600:1417:56::174c:9d0a → 2401:4900:8840:b020:556f:99ec:de73:e6dd TCP 74 443 → 53180 [FIN, ACK] Seq=25 Ack=2 Win=536 Len=0
   62   7.154793 2600:1417:56::174c:9d0a → 2401:4900:8840:b020:556f:99ec:de73:e6dd TCP 98 [TCP Out-Of-Order] 443 → 53179 [PSH, ACK] Seq=1 Ack=2 Win=545 Len=24
   63   7.154793 2600:1417:56::174c:9d0a → 2401:4900:8840:b020:556f:99ec:de73:e6dd TCP 98 [TCP Out-Of-Order] 443 → 53181 [PSH, ACK] Seq=1 Ack=2 Win=558 Len=24
   64   7.154793 2600:1417:56::174c:9d0a → 2401:4900:8840:b020:556f:99ec:de73:e6dd TCP 98 [TCP Out-Of-Order] 443 → 53180 [PSH, ACK] Seq=1 Ack=2 Win=536 Len=24
   65   7.154862 2401:4900:8840:b020:556f:99ec:de73:e6dd → 2600:1417:56::174c:9d0a TCP 74 [TCP Dup ACK 56#1] 53179 → 443 [ACK] Seq=2 Ack=1 Win=255 Len=0
   66   7.154895 2401:4900:8840:b020:556f:99ec:de73:e6dd → 2600:1417:56::174c:9d0a TCP 74 [TCP Dup ACK 57#1] 53181 → 443 [ACK] Seq=2 Ack=1 Win=255 Len=0
   67   7.154909 2401:4900:8840:b020:556f:99ec:de73:e6dd → 2600:1417:56::174c:9d0a TCP 74 [TCP Dup ACK 58#1] 53180 → 443 [ACK] Seq=2 Ack=1 Win=255 Len=0
   68   7.154933 2401:4900:8840:b020:556f:99ec:de73:e6dd → 2600:1417:56::174c:9d0a TCP 74 53179 → 443 [RST, ACK] Seq=2 Ack=25 Win=0 Len=0
   69   7.154952 2401:4900:8840:b020:556f:99ec:de73:e6dd → 2600:1417:56::174c:9d0a TCP 74 53181 → 443 [RST, ACK] Seq=2 Ack=25 Win=0 Len=0
   70   7.154968 2401:4900:8840:b020:556f:99ec:de73:e6dd → 2600:1417:56::174c:9d0a TCP 74 53180 → 443 [RST, ACK] Seq=2 Ack=25 Win=0 Len=0
   71   9.307862 52.22.119.135 → 192.168.1.8  TCP 54 443 → 53148 [ACK] Seq=1 Ack=1 Win=8 Len=0
   72   9.307907  192.168.1.8 → 52.22.119.135 TCP 54 [TCP ACKed unseen segment] 53148 → 443 [ACK] Seq=1 Ack=2 Win=255 Len=0
   73   9.802912  192.168.1.8 → 18.214.174.26 SSL 55 
   74  10.065981 18.214.174.26 → 192.168.1.8  TCP 66 443 → 53184 [ACK] Seq=1 Ack=2 Win=501 Len=0 SLE=1 SRE=2
   75  10.364560 2401:4900:8840:b020:556f:99ec:de73:e6dd → 2606:4700:4400::ac40:9bd1 SSL 75 
   76  10.369630 2606:4700:4400::ac40:9bd1 → 2401:4900:8840:b020:556f:99ec:de73:e6dd TCP 86 443 → 52881 [ACK] Seq=1 Ack=2 Win=123 Len=0 SLE=1 SRE=2
   77  10.529491 157.90.91.74 → 192.168.1.8  TLSv1.2 78 Application Data
   78  10.529859  192.168.1.8 → 157.90.91.74 TLSv1.2 82 Application Data
   79  10.683303 157.90.91.74 → 192.168.1.8  TCP 54 443 → 52575 [ACK] Seq=25 Ack=29 Win=543 Len=0
   80  20.012682  192.168.1.8 → 162.159.192.1 TCP 54 53193 → 443 [FIN, ACK] Seq=1 Ack=1 Win=251 Len=0
   81  20.012780  192.168.1.8 → 162.159.192.1 TCP 78 [TCP Out-Of-Order] 53193 → 443 [PSH, ACK] Seq=4294967273 Ack=1 Win=251 Len=24
   82  20.143104 162.159.192.1 → 192.168.1.8  TCP 66 443 → 53193 [ACK] Seq=1 Ack=4294967273 Win=19 Len=0 SLE=1 SRE=2
   83  20.143104 162.159.192.1 → 192.168.1.8  TCP 54 443 → 53193 [ACK] Seq=1 Ack=2 Win=19 Len=0
   84  20.144724 162.159.192.1 → 192.168.1.8  TCP 54 443 → 53193 [FIN, ACK] Seq=1 Ack=2 Win=19 Len=0
   85  20.144911  192.168.1.8 → 162.159.192.1 TCP 54 53193 → 443 [ACK] Seq=2 Ack=2 Win=251 Len=0
   86  22.008127 2401:4900:8840:b020:556f:99ec:de73:e6dd → 2404:6800:4002:815::2003 SSL 75 
   87  22.523151  192.168.1.8 → 98.85.87.141 TCP 66 53221 → 443 [SYN] Seq=0 Win=65535 Len=0 MSS=1460 WS=256 SACK_PERM
   88  22.769002  192.168.1.8 → 98.85.87.141 TCP 66 53222 → 443 [SYN] Seq=0 Win=65535 Len=0 MSS=1460 WS=256 SACK_PERM
   89  22.824907 98.85.87.141 → 192.168.1.8  TCP 66 443 → 53221 [SYN, ACK] Seq=0 Ack=1 Win=26883 Len=0 MSS=1250 SACK_PERM WS=256
   90  22.825007  192.168.1.8 → 98.85.87.141 TCP 54 53221 → 443 [ACK] Seq=1 Ack=1 Win=65280 Len=0
   91  22.825563  192.168.1.8 → 98.85.87.141 TLSv1.2 2030 Client Hello (SNI=extension.femetrics.grammarly.io)
   92  23.071505 98.85.87.141 → 192.168.1.8  TCP 66 443 → 53222 [SYN, ACK] Seq=0 Ack=1 Win=26883 Len=0 MSS=1250 SACK_PERM WS=256
   93  23.071646  192.168.1.8 → 98.85.87.141 TCP 54 53222 → 443 [ACK] Seq=1 Ack=1 Win=65280 Len=0
   94  23.072167  192.168.1.8 → 98.85.87.141 TLSv1.2 1998 Client Hello (SNI=extension.femetrics.grammarly.io)
   95  23.129007 98.85.87.141 → 192.168.1.8  TCP 54 443 → 53221 [ACK] Seq=1 Ack=1251 Win=45056 Len=0
   96  23.129007 98.85.87.141 → 192.168.1.8  TCP 54 443 → 53221 [ACK] Seq=1 Ack=1977 Win=47360 Len=0
   97  23.129007 98.85.87.141 → 192.168.1.8  TLSv1.2 3804 Server Hello
   98  23.129169  192.168.1.8 → 98.85.87.141 TCP 54 53221 → 443 [ACK] Seq=1977 Ack=3751 Win=65280 Len=0
   99  23.129206 98.85.87.141 → 192.168.1.8  TLSv1.2 601 Certificate, Server Key Exchange, Server Hello Done
  100  23.129284  192.168.1.8 → 98.85.87.141 TCP 54 53221 → 443 [ACK] Seq=1977 Ack=4298 Win=64768 Len=0
  101  23.129748  192.168.1.8 → 98.85.87.141 TLSv1.2 180 Client Key Exchange, Change Cipher Spec, Encrypted Handshake Message
  102  23.129919  192.168.1.8 → 98.85.87.141 TLSv1.2 153 Application Data
  103  23.130040  192.168.1.8 → 98.85.87.141 TLSv1.2 426 Application Data
  104  23.130083  192.168.1.8 → 98.85.87.141 TLSv1.2 605 Application Data
  105  23.209777  192.168.1.8 → 54.192.142.105 SSL 55 
  106  23.216274 54.192.142.105 → 192.168.1.8  TCP 66 443 → 53213 [ACK] Seq=1 Ack=2 Win=146 Len=0 SLE=1 SRE=2
  107  23.375753 98.85.87.141 → 192.168.1.8  TCP 54 443 → 53222 [ACK] Seq=1 Ack=1251 Win=29440 Len=0
  108  23.375753 98.85.87.141 → 192.168.1.8  TCP 54 443 → 53222 [ACK] Seq=1 Ack=1945 Win=32000 Len=0
  109  23.375753 98.85.87.141 → 192.168.1.8  TLSv1.2 3804 Server Hello
  110  23.375891 98.85.87.141 → 192.168.1.8  TLSv1.2 601 Certificate, Server Key Exchange, Server Hello Done
  111  23.375918  192.168.1.8 → 98.85.87.141 TCP 54 53222 → 443 [ACK] Seq=1945 Ack=3751 Win=65280 Len=0
  112  23.375998  192.168.1.8 → 98.85.87.141 TCP 54 53222 → 443 [ACK] Seq=1945 Ack=4298 Win=64768 Len=0
  113  23.376354  192.168.1.8 → 98.85.87.141 TLSv1.2 180 Client Key Exchange, Change Cipher Spec, Encrypted Handshake Message
  114  23.431580 98.85.87.141 → 192.168.1.8  TCP 54 443 → 53221 [ACK] Seq=4298 Ack=3125 Win=52480 Len=0
  115  23.431580 98.85.87.141 → 192.168.1.8  TLSv1.2 258 New Session Ticket, Change Cipher Spec, Encrypted Handshake Message
  116  23.431640 98.85.87.141 → 192.168.1.8  TLSv1.2 132 Application Data
  117  23.431728  192.168.1.8 → 98.85.87.141 TCP 54 53221 → 443 [ACK] Seq=3125 Ack=4580 Win=64512 Len=0
  118  23.431984  192.168.1.8 → 98.85.87.141 TLSv1.2 92 Application Data
  119  23.437893 98.85.87.141 → 192.168.1.8  TLSv1.2 426 Application Data
  120  23.490459  192.168.1.8 → 98.85.87.141 TCP 54 53221 → 443 [ACK] Seq=3163 Ack=4952 Win=64256 Len=0
  121  23.682282 98.85.87.141 → 192.168.1.8  TCP 54 443 → 53222 [ACK] Seq=4298 Ack=2071 Win=32000 Len=0
  122  23.682282 98.85.87.141 → 192.168.1.8  TLSv1.2 258 New Session Ticket, Change Cipher Spec, Encrypted Handshake Message
  123  23.682447 98.85.87.141 → 192.168.1.8  TLSv1.2 123 Application Data
  124  23.682494  192.168.1.8 → 98.85.87.141 TCP 54 53222 → 443 [ACK] Seq=2071 Ack=4571 Win=64512 Len=0
  125  23.789385 98.85.87.141 → 192.168.1.8  TCP 54 443 → 53221 [ACK] Seq=4952 Ack=3163 Win=52480 Len=0
  126  24.615743 52.22.119.135 → 192.168.1.8  TCP 54 [TCP Dup ACK 71#1] 443 → 53148 [ACK] Seq=1 Ack=1 Win=8 Len=0
  127  24.615837  192.168.1.8 → 52.22.119.135 TCP 54 [TCP Dup ACK 72#1] 53148 → 443 [ACK] Seq=1 Ack=2 Win=255 Len=0
  128  26.791060 91.108.56.178 → 192.168.1.8  SSL 159 Continuation Data
  129  26.791796  192.168.1.8 → 91.108.56.178 SSL 303 Continuation Data
  130  26.864715 91.108.56.178 → 192.168.1.8  TCP 56 443 → 52443 [ACK] Seq=106 Ack=435 Win=7230 Len=0
  131  26.867124 91.108.56.178 → 192.168.1.8  SSL 143 Continuation Data
  132  26.916633  192.168.1.8 → 91.108.56.178 TCP 54 52443 → 443 [ACK] Seq=435 Ack=195 Win=511 Len=0
  133  29.071059 2401:4900:8840:b020:556f:99ec:de73:e6dd → 2404:6800:4003:c03::bc TCP 75 52493 → 5228 [ACK] Seq=1 Ack=1 Win=251 Len=1
